[
  {
    "id": "photo-001",
    "gcsUri": "gs://your-dev-bucket/sample-photos/photo-001.jpg",
    "contextText": "CONTEXT (reference only, do not treat as ground truth):\nnearestMonitorId: DL-RKPuram\nnearestMonitorAQI: 312\nsatelliteAerosolIndex: 1.8\nlocalTimeOfDay: morning\nseason: winter",
    "expected": {
      "sourceClassification": "crop_residue_burning",
      "severityEstimate": 4,
      "needsHumanReview": false
    },
    "notes": "Clear stubble-burning field shot, daylight, unambiguous."
  },
  {
    "id": "photo-002",
    "gcsUri": "gs://your-dev-bucket/sample-photos/photo-002.jpg",
    "contextText": "CONTEXT (reference only, do not treat as ground truth):\nnearestMonitorId: none within radius\nnearestMonitorAQI: unknown\nsatelliteAerosolIndex: unknown\nlocalTimeOfDay: evening\nseason: post-monsoon",
    "expected": {
      "sourceClassification": "indeterminate",
      "needsHumanReview": false
    },
    "notes": "Indoor photo of a kitchen, submitted by mistake -- tests calibration rule 2."
  },
  {
    "id": "photo-003",
    "gcsUri": "gs://your-dev-bucket/sample-photos/photo-003.jpg",
    "contextText": "CONTEXT (reference only, do not treat as ground truth):\nnearestMonitorId: HR-Gurugram3\nnearestMonitorAQI: 95\nsatelliteAerosolIndex: 0.6\nlocalTimeOfDay: golden hour\nseason: winter",
    "expected": {
      "sourceClassification": "no_visible_pollution",
      "severityEstimate": 1,
      "needsHumanReview": false
    },
    "notes": "Golden-hour haze that looks worse than it is -- tests calibration rule 1 directly."
  }
]
